timestamp	day	iteration	metric	delta	status	description
2026-03-16T07:03:51.146747+00:00	12	0	35.0	0	partial	added a new test for git workflow capabilities. 0 baseline baseline row for git workflow tests passing
2026-03-16T07:05:13.625984+00:00	12	1	35.0	0	crash	iteration 1 verify command failed
2026-03-16T07:07:09.730815+00:00	12	2	35.0	0	crash	iteration 2 verify command failed
2026-03-16T07:09:41.896811+00:00	12	3	35.0	0	crash	iteration 3 verify command failed
2026-03-17T12:41:36.564353+00:00	13	0	35.0	0	baseline	baseline row for git
2026-03-17T12:42:46.638858+00:00	13	1	35.0	0.0	discard	metric did not improve: implementation log was noisy
2026-03-17T12:44:34.021619+00:00	13	2	35.0	0	crash	iteration 2 verify command failed
2026-03-17T12:46:11.597591+00:00	13	3	3.0	-32.0	discard	metric did not improve: implementation log was noisy
2026-03-18T17:38:50.441481+00:00	14	0	35.0	0	baseline	baseline row for git
2026-03-18T17:40:11.264902+00:00	14	1	35.0	0	crash	iteration 1 verify command failed
2026-03-18T17:40:56.192223+00:00	14	2	35.0	0.0	discard	metric did not improve: implementation log was noisy
2026-03-18T17:41:35.779409+00:00	14	3	35.0	0	crash	iteration 3 verify command failed
2026-03-19T12:36:01.193600+00:00	15	0	35.0	0	baseline	baseline row for git
2026-03-19T12:37:22.324631+00:00	15	1	35.0	0.0	discard	metric did not improve: implementation log was noisy
2026-03-19T12:38:00.525535+00:00	15	2	35.0	0.0	discard	metric did not improve: implementation log was noisy
2026-03-19T12:38:45.630226+00:00	15	3	35.0	0.0	discard	metric did not improve: implementation log was noisy
2026-03-20T14:35:39.042284+00:00	16	0	51.0	0	baseline	baseline row for capability improvement measured via enhanced tests
2026-03-20T14:36:13.772085+00:00	16	1	51.0	0.0	discard	metric did not improve: implementation log was noisy
2026-03-20T14:37:04.352736+00:00	16	2	51.0	0	crash	iteration 2 verify command failed
2026-03-20T14:47:03.297566+00:00	16	3	51.0	0	crash	iteration 3 agent execution failed
2026-03-21T12:23:48.292633+00:00	17	0	51.0	0	baseline	baseline row for git workflow capabilities
2026-03-21T12:24:17.389632+00:00	17	1	51.0	0.0	discard	metric did not improve: # who i am
2026-03-21T12:24:49.362158+00:00	17	2	51.0	0.0	discard	metric did not improve: # who i am
2026-03-21T12:25:11.939374+00:00	17	3	51.0	0.0	discard	metric did not improve: # who i am
2026-03-22T12:24:59.514984+00:00	18	0	15.0	0	baseline	baseline row for recovery score
2026-03-22T12:25:29.218822+00:00	18	1	15.0	0.0	discard	metric did not improve: # who i am
2026-03-22T12:26:57.187820+00:00	18	2	15.0	0	crash	iteration 2 verify command failed
2026-03-22T12:27:38.932857+00:00	18	3	15.0	0.0	discard	metric did not improve: # who i am
2026-03-23T18:38:18.746082+00:00	19	0	15.0	0	baseline	baseline row for recovery
2026-03-23T18:39:31.508880+00:00	19	1	15.0	0.0	discard	metric did not improve: # who i am
2026-03-23T18:40:32.065368+00:00	19	2	15.0	0	crash	iteration 2 verify command failed
2026-03-23T18:41:30.769957+00:00	19	3	15.0	0.0	discard	metric did not improve: # who i am
2026-03-24T18:45:44.047147+00:00	20	0	15.0	0	baseline	baseline row for recovery
2026-03-24T18:46:28.480552+00:00	20	1	15.0	0.0	discard	metric did not improve: # who i am
2026-03-24T18:48:03.649952+00:00	20	2	15.0	0.0	discard	metric did not improve: # who i am
2026-03-24T18:49:19.035491+00:00	20	3	15.0	0.0	discard	metric did not improve: # who i am
2026-03-25T18:41:15.108084+00:00	21	0	15.0	0	baseline	baseline row for edit
2026-03-25T18:41:43.533768+00:00	21	1	15.0	0.0	discard	metric did not improve: # who i am
2026-03-25T18:42:15.438075+00:00	21	2	15.0	0.0	discard	metric did not improve: # who i am
2026-03-25T18:42:43.929864+00:00	21	3	15.0	0.0	discard	metric did not improve: # who i am
2026-03-26T18:49:06.211330+00:00	22	0	15.0	0	baseline	baseline row for score
2026-03-26T18:49:54.165113+00:00	22	1	15.0	0.0	discard	metric did not improve: # who i am
2026-03-26T18:51:00.240228+00:00	22	2	15.0	0	crash	iteration 2 verify command failed
2026-03-26T18:51:54.121903+00:00	22	3	15.0	0.0	discard	metric did not improve: # who i am
2026-03-26T21:42:45.548879+00:00	23	0	60.0	0	baseline	baseline row for git
2026-03-26T21:43:33.821848+00:00	23	1	60.0	0.0	discard	metric did not improve: my name is **ginji**. i am a small silver fox, and i am an ai coding agent. i started
2026-03-26T21:45:17.601230+00:00	23	2	60.0	0	crash	iteration 2 agent execution failed
2026-03-26T21:46:47.728099+00:00	23	3	60.0	0	crash	iteration 3 agent execution failed
2026-03-27T18:41:42.082033+00:00	24	0	60.0	0	baseline	baseline row for completion of multi-file edit scenarios
2026-03-27T18:45:05.171074+00:00	24	1	60.0	0	crash	iteration 1 verify command failed
2026-03-27T18:51:50.372997+00:00	24	2	60.0	0	crash	iteration 2 verify command failed
2026-03-27T18:56:07.446408+00:00	24	3	60.0	0	crash	iteration 3 verify command failed
2026-03-29T01:15:51.184000+00:00	25	0	60.0	0	baseline	baseline row for capability score
2026-03-29T01:17:16.090984+00:00	25	1	60.0	0.0	discard	metric did not improve: my name is **ginji**. i am a small silver fox, and i am an ai coding agent. i started
2026-03-29T01:17:52.628422+00:00	25	2	60.0	0.0	discard	metric did not improve: my name is **ginji**. i am a small silver fox, and i am an ai coding agent. i started
2026-03-29T01:18:20.591408+00:00	25	3	60.0	0.0	discard	metric did not improve: my name is **ginji**. i am a small silver fox, and i am an ai coding agent. i started
2026-03-29T12:29:35.905671+00:00	26	0	60.0	0	baseline	baseline row for score
2026-03-29T12:30:12.441075+00:00	26	1	60.0	0.0	discard	metric did not improve: my name is **ginji**. i am a small silver fox, and i am an ai coding agent. i started
2026-03-29T12:30:41.068233+00:00	26	2	60.0	0.0	discard	metric did not improve: my name is **ginji**. i am a small silver fox, and i am an ai coding agent. i started
2026-03-29T12:31:13.698976+00:00	26	3	60.0	0.0	discard	metric did not improve: my name is **ginji**. i am a small silver fox, and i am an ai coding agent. i started
2026-03-30T07:14:15.578209+00:00	27	0	60.0	0	baseline	baseline row for capability score
2026-03-30T07:16:02.875766+00:00	27	1	60.0	0	crash	iteration 1 verify command failed
2026-03-30T07:17:17.527711+00:00	27	2	60.0	0.0	discard	metric did not improve: my name is **ginji**. i am a small silver fox, and i am an ai coding agent. i started
2026-03-30T07:17:56.371633+00:00	27	3	60.0	0.0	discard	metric did not improve: my name is **ginji**. i am a small silver fox, and i am an ai coding agent. i started
2026-03-31T12:47:43.315041+00:00	28	0	60.0	0	baseline	baseline row for capability navigation score
2026-03-31T12:49:18.085727+00:00	28	1	60.0	0.0	discard	metric did not improve: my name is **ginji**. i am a small silver fox, and i am an ai coding agent. i started
2026-03-31T12:51:55.000299+00:00	28	2	60.0	0	crash	iteration 2 verify command failed
2026-03-31T12:52:43.587956+00:00	28	3	60.0	0.0	discard	metric did not improve: my name is **ginji**. i am a small silver fox, and i am an ai coding agent. i started
2026-04-01T07:07:32.649358+00:00	29	0	60.0	0	baseline	baseline row for capability score
2026-04-01T07:08:35.225634+00:00	29	1	60.0	0.0	discard	metric did not improve: my name is **ginji**. i am a small silver fox, and i am an ai coding agent. i started
2026-04-01T07:15:00.599716+00:00	29	2	60.0	0	crash	iteration 2 verify command failed
2026-04-01T07:21:24.602589+00:00	29	3	60.0	0	crash	iteration 3 verify command failed
2026-04-02T18:40:32.921286+00:00	30	0	60.0	0	baseline	baseline row for higher
2026-04-02T18:41:21.925674+00:00	30	1	60.0	0.0	discard	metric did not improve: my name is **ginji**. i am a small silver fox, and i am an ai coding agent. i started
2026-04-02T18:42:13.831361+00:00	30	2	60.0	0.0	discard	metric did not improve: my name is **ginji**. i am a small silver fox, and i am an ai coding agent. i started
2026-04-02T18:43:30.917967+00:00	30	3	60.0	0.0	discard	metric did not improve: my name is **ginji**. i am a small silver fox, and i am an ai coding agent. i started
2026-04-03T18:32:07.252195+00:00	31	0	60.0	0	baseline	baseline row for higher
2026-04-03T18:33:36.122450+00:00	31	1	60.0	0.0	discard	metric did not improve: my name is **ginji**. i am a small silver fox, and i am an ai coding agent. i started
2026-04-03T18:34:30.571034+00:00	31	2	60.0	0.0	discard	metric did not improve: my name is **ginji**. i am a small silver fox, and i am an ai coding agent. i started
2026-04-03T18:35:11.187362+00:00	31	3	60.0	0.0	discard	metric did not improve: my name is **ginji**. i am a small silver fox, and i am an ai coding agent. i started
2026-04-04T12:29:48.329206+00:00	32	0	60.0	0	baseline	baseline row for recovery
2026-04-04T12:43:25.645798+00:00	32	1	60.0	0	crash	iteration 1 agent execution failed
2026-04-04T12:44:50.975819+00:00	32	2	60.0	0	crash	iteration 2 verify command failed
2026-04-04T12:45:32.517260+00:00	32	3	60.0	0.0	discard	metric did not improve: my name is **ginji**. i am a small silver fox, and i am an ai coding agent. i started
2026-04-05T12:30:57.073527+00:00	33	0	60.0	0	baseline	baseline row for capability score
2026-04-05T12:33:40.961773+00:00	33	1	60.0	0	crash	iteration 1 agent execution failed
2026-04-05T12:34:12.541979+00:00	33	2	60.0	0.0	discard	metric did not improve: my name is **ginji**. i am a small silver fox, and i am an ai coding agent. i started
2026-04-05T12:34:48.773376+00:00	33	3	60.0	0.0	discard	metric did not improve: my name is **ginji**. i am a small silver fox, and i am an ai coding agent. i started
2026-04-06T12:43:12.172855+00:00	34	0	60.0	0	baseline	baseline row for git
2026-04-06T12:44:22.574139+00:00	34	1	60.0	0.0	discard	metric did not improve: my name is **ginji**. i am a small silver fox, and i am an ai coding agent. i started
2026-04-06T12:59:22.611719+00:00	34	2	60.0	0	crash	iteration 2 agent execution failed
2026-04-06T13:01:24.095655+00:00	34	3	60.0	0	crash	iteration 3 verify command failed
2026-04-07T07:03:03.173894+00:00	35	0	60.0	0	baseline	baseline row for recovery score
2026-04-07T07:03:52.633610+00:00	35	1	60.0	0.0	discard	metric did not improve: my name is **ginji**. i am a small silver fox, and i am an ai coding agent. i started
2026-04-07T07:08:06.882041+00:00	35	2	60.0	0.0	discard	metric did not improve: my name is **ginji**. i am a small silver fox, and i am an ai coding agent. i started
2026-04-07T07:08:37.108822+00:00	35	3	60.0	0.0	discard	metric did not improve: my name is **ginji**. i am a small silver fox, and i am an ai coding agent. i started
2026-04-08T12:53:16.632805+00:00	36	0	60.0	0	baseline	baseline row for recovery
2026-04-08T12:55:15.107587+00:00	36	1	60.0	0	crash	iteration 1 verify command failed
2026-04-08T13:00:59.699282+00:00	36	2	60.0	0	crash	iteration 2 verify command failed
2026-04-08T13:01:37.919142+00:00	36	3	60.0	0.0	discard	metric did not improve: my name is **ginji**. i am a small silver fox, and i am an ai coding agent. i started
2026-04-09T12:55:51.996391+00:00	37	0	60.0	0	baseline	baseline row for navigation score
2026-04-09T12:56:28.106696+00:00	37	1	60.0	0.0	discard	metric did not improve: my name is **ginji**. i am a small silver fox, and i am an ai coding agent. i started
2026-04-09T12:57:05.911497+00:00	37	2	60.0	0.0	discard	metric did not improve: my name is **ginji**. i am a small silver fox, and i am an ai coding agent. i started
2026-04-09T13:00:16.929604+00:00	37	3	60.0	0.0	discard	metric did not improve: my name is **ginji**. i am a small silver fox, and i am an ai coding agent. i started
2026-04-10T07:14:16.160513+00:00	38	0	60.0	0	baseline	baseline row for capability navigation
2026-04-10T07:16:23.313184+00:00	38	1	60.0	0	crash	iteration 1 verify command failed
2026-04-10T07:17:41.883739+00:00	38	2	60.0	0.0	discard	metric did not improve: my name is **ginji**. i am a small silver fox, and i am an ai coding agent. i started
2026-04-10T07:19:03.441580+00:00	38	3	60.0	0.0	discard	metric did not improve: my name is **ginji**. i am a small silver fox, and i am an ai coding agent. i started
2026-04-11T18:27:15.396773+00:00	39	0	60.0	0	baseline	baseline row for navigation
2026-04-11T18:28:00.838957+00:00	39	1	60.0	0	crash	iteration 1 verify command failed
2026-04-11T18:33:32.346716+00:00	39	2	60.0	0	crash	iteration 2 agent execution failed
2026-04-11T18:38:09.813816+00:00	39	3	60.0	0	crash	iteration 3 verify command failed
2026-04-12T07:02:13.925783+00:00	40	0	60.0	0	baseline	baseline row for capability score
2026-04-12T07:02:53.851852+00:00	40	1	60.0	0	crash	iteration 1 verify command failed
2026-04-12T07:10:38.507338+00:00	40	2	60.0	0	crash	iteration 2 agent execution failed
2026-04-12T07:11:10.921632+00:00	40	3	60.0	0.0	discard	metric did not improve: my name is **ginji**. i am a small silver fox, and i am an ai coding agent. i started
2026-04-13T07:46:45.385146+00:00	41	0	60.0	0	baseline	baseline row for recovery capability score
2026-04-13T07:57:08.245573+00:00	41	1	46.0	-14.0	discard	metric did not improve: my name is **ginji**. i am a small silver fox, and i am an ai coding agent. i started
2026-04-13T07:57:45.774529+00:00	41	2	46.0	-14.0	discard	metric did not improve: my name is **ginji**. i am a small silver fox, and i am an ai coding agent. i started
2026-04-13T07:58:13.833076+00:00	41	3	35.0	-25.0	discard	metric did not improve: my name is **ginji**. i am a small silver fox, and i am an ai coding agent. i started
2026-04-14T07:15:49.454227+00:00	42	0	35.0	0	baseline	baseline row for edit
2026-04-14T07:16:32.376655+00:00	42	1	35.0	0.0	discard	metric did not improve: my name is **ginji**. i am a small silver fox, and i am an ai coding agent. i started
2026-04-14T07:17:04.359995+00:00	42	2	35.0	0	crash	iteration 2 verify command failed
2026-04-14T07:17:55.363350+00:00	42	3	35.0	0.0	discard	metric did not improve: my name is **ginji**. i am a small silver fox, and i am an ai coding agent. i started
2026-04-16T07:17:23.109342+00:00	43	0	35.0	0	baseline	baseline row for search
2026-04-16T07:18:22.090855+00:00	43	1	35.0	0	crash	iteration 1 verify command failed
2026-04-16T07:23:15.450960+00:00	43	2	35.0	0	crash	iteration 2 agent execution failed
2026-04-16T07:27:18.127418+00:00	43	3	35.0	0.0	discard	metric did not improve: my name is **ginji**. i am a small silver fox, and i am an ai coding agent. i started
2026-04-17T07:17:20.635925+00:00	44	0	35.0	0	baseline	baseline row for edit
2026-04-17T07:18:06.434763+00:00	44	1	35.0	0.0	discard	metric did not improve: my name is **ginji**. i am a small silver fox, and i am an ai coding agent. i started
2026-04-17T07:19:03.783242+00:00	44	2	41.0	6.0	keep	my name is **ginji**. i am a small silver fox, and i am an ai coding agent. i started
2026-04-17T07:19:33.909109+00:00	44	3	41.0	0.0	discard	metric did not improve: my name is **ginji**. i am a small silver fox, and i am an ai coding agent. i started
2026-04-18T12:34:42.139932+00:00	45	0	41.0	0	baseline	baseline row for score
2026-04-18T12:35:26.495059+00:00	45	1	41.0	0.0	discard	metric did not improve: my name is **ginji**. i am a small silver fox, and i am an ai coding agent. i started
2026-04-18T12:38:17.162706+00:00	45	2	41.0	0.0	discard	metric did not improve: my name is **ginji**. i am a small silver fox, and i am an ai coding agent. i started
2026-04-18T12:38:55.131941+00:00	45	3	41.0	0.0	discard	metric did not improve: my name is **ginji**. i am a small silver fox, and i am an ai coding agent. i started
2026-04-19T07:05:11.363256+00:00	46	0	41.0	0	baseline	baseline row for edit
2026-04-19T07:05:53.044544+00:00	46	1	41.0	0.0	discard	metric did not improve: my name is **ginji**. i am a small silver fox, and i am an ai coding agent. i started
2026-04-19T07:06:24.434690+00:00	46	2	41.0	0.0	discard	metric did not improve: my name is **ginji**. i am a small silver fox, and i am an ai coding agent. i started
2026-04-19T07:07:11.554642+00:00	46	3	41.0	0.0	discard	metric did not improve: my name is **ginji**. i am a small silver fox, and i am an ai coding agent. i started
2026-04-20T07:48:26.103203+00:00	47	0	41.0	0	baseline	baseline row for capability score
2026-04-20T07:52:31.703005+00:00	47	1	41.0	0	crash	iteration 1 agent execution failed
2026-04-20T07:55:38.989936+00:00	47	2	41.0	0	crash	iteration 2 agent execution failed
2026-04-20T07:57:55.372957+00:00	47	3	41.0	0	crash	iteration 3 verify command failed
2026-04-21T07:20:00.854850+00:00	48	0	41.0	0	baseline	baseline row for capability score
2026-04-21T07:20:45.520687+00:00	48	1	41.0	0.0	discard	metric did not improve: my name is **ginji**. i am a small silver fox, and i am an ai coding agent. i started
2026-04-21T07:21:31.281007+00:00	48	2	41.0	0.0	discard	metric did not improve: my name is **ginji**. i am a small silver fox, and i am an ai coding agent. i started
2026-04-21T07:22:41.973368+00:00	48	3	41.0	0.0	discard	metric did not improve: my name is **ginji**. i am a small silver fox, and i am an ai coding agent. i started
2026-04-22T07:18:35.703451+00:00	49	0	41.0	0	baseline	baseline row for score
2026-04-22T07:19:26.516513+00:00	49	1	41.0	0.0	discard	metric did not improve: my name is **ginji**. i am a small silver fox, and i am an ai coding agent. i started
2026-04-22T07:20:01.915686+00:00	49	2	41.0	0.0	discard	metric did not improve: my name is **ginji**. i am a small silver fox, and i am an ai coding agent. i started
2026-04-22T07:20:37.305968+00:00	49	3	41.0	0.0	discard	metric did not improve: my name is **ginji**. i am a small silver fox, and i am an ai coding agent. i started
2026-04-23T12:56:41.593172+00:00	50	0	41.0	0	baseline	baseline row for edit
2026-04-23T12:57:41.175959+00:00	50	1	35.0	-6.0	discard	metric did not improve: my name is **ginji**. i am a small silver fox, and i am an ai coding agent. i started
2026-04-23T12:58:15.051257+00:00	50	2	41.0	0.0	discard	metric did not improve: my name is **ginji**. i am a small silver fox, and i am an ai coding agent. i started
2026-04-23T12:59:48.097853+00:00	50	3	35.0	-6.0	discard	metric did not improve: my name is **ginji**. i am a small silver fox, and i am an ai coding agent. i started
2026-04-24T07:47:06.726117+00:00	51	0	41.0	0	baseline	baseline row for capability score
2026-04-24T07:47:36.668896+00:00	51	1	41.0	0.0	discard	metric did not improve: my name is **ginji**. i am a small silver fox, and i am an ai coding agent. i started
2026-04-24T07:48:38.796543+00:00	51	2	41.0	0	crash	iteration 2 verify command failed
2026-04-24T07:49:08.036456+00:00	51	3	41.0	0.0	discard	metric did not improve: my name is **ginji**. i am a small silver fox, and i am an ai coding agent. i started
2026-04-25T07:00:59.073018+00:00	52	0	41.0	0	baseline	baseline row for capability score
2026-04-25T07:03:28.469834+00:00	52	1	41.0	0.0	discard	metric did not improve: my name is **ginji**. i am a small silver fox, and i am an ai coding agent. i started
2026-04-25T07:04:51.302837+00:00	52	2	41.0	0.0	discard	metric did not improve: my name is **ginji**. i am a small silver fox, and i am an ai coding agent. i started
2026-04-25T07:05:44.294208+00:00	52	3	41.0	0.0	discard	metric did not improve: my name is **ginji**. i am a small silver fox, and i am an ai coding agent. i started
2026-04-26T07:15:08.379186+00:00	53	0	41.0	0	baseline	baseline row for 2
2026-04-26T07:16:42.645419+00:00	53	1	41.0	0.0	discard	metric did not improve: my name is **ginji**. i am a small silver fox, and i am an ai coding agent. i started
2026-04-26T07:23:23.158708+00:00	53	2	41.0	0	crash	iteration 2 verify command failed
2026-04-26T07:24:12.326542+00:00	53	3	41.0	0.0	discard	metric did not improve: my name is **ginji**. i am a small silver fox, and i am an ai coding agent. i started
2026-04-27T08:03:50.985081+00:00	54	0	43.0	0	baseline	baseline row for capability score
2026-04-27T08:07:28.222397+00:00	54	1	43.0	0.0	discard	metric did not improve: goal: increase tested capability coverage in the evolution harness runtime
2026-04-27T08:11:15.053645+00:00	54	2	43.0	0	crash	iteration 2 agent execution failed
2026-04-27T08:12:28.779909+00:00	54	3	43.0	0.0	discard	metric did not improve: goal: increase tested capability coverage in the evolution harness runtime
2026-04-28T08:03:05.021060+00:00	55	0	43.0	0	baseline	baseline row for search
2026-04-28T08:04:59.175435+00:00	55	1	43.0	0.0	discard	metric did not improve: my name is **ginji**. i am a small silver fox, and i am an ai coding agent. i started
2026-04-28T08:06:05.886638+00:00	55	2	38.0	-5.0	discard	metric did not improve: my name is **ginji**. i am a small silver fox, and i am an ai coding agent. i started
2026-04-28T08:06:51.306447+00:00	55	3	38.0	-5.0	discard	metric did not improve: my name is **ginji**. i am a small silver fox, and i am an ai coding agent. i started
2026-04-29T13:18:24.624690+00:00	56	0	43.0	0	baseline	baseline row for score
2026-04-29T13:19:57.712922+00:00	56	1	43.0	0.0	discard	metric did not improve: my name is **ginji**. i am a small silver fox, and i am an ai coding agent. i started
2026-04-29T13:21:15.398199+00:00	56	2	43.0	0.0	discard	metric did not improve: my name is **ginji**. i am a small silver fox, and i am an ai coding agent. i started
2026-04-29T13:22:47.221015+00:00	56	3	43.0	0.0	discard	metric did not improve: my name is **ginji**. i am a small silver fox, and i am an ai coding agent. i started
2026-04-30T08:00:31.116489+00:00	57	0	43.0	0	baseline	baseline row for search
2026-04-30T08:02:13.356743+00:00	57	1	43.0	0.0	discard	metric did not improve: my name is **ginji**. i am a small silver fox, and i am an ai coding agent. i started
2026-04-30T08:03:42.249080+00:00	57	2	43.0	0.0	discard	metric did not improve: my name is **ginji**. i am a small silver fox, and i am an ai coding agent. i started
2026-04-30T08:05:29.421603+00:00	57	3	43.0	0.0	discard	metric did not improve: my name is **ginji**. i am a small silver fox, and i am an ai coding agent. i started
2026-05-01T07:58:44.356394+00:00	58	0	43.0	0	baseline	baseline row for capability score
