timestamp	day	iteration	metric	delta	status	description
2026-05-01T07:59:12.069868+00:00	58	1	43.0	0.0	discard	metric did not improve: goal: increase tested capability coverage in the evolution harness runtime
2026-05-01T07:59:38.794750+00:00	58	2	43.0	0.0	discard	metric did not improve: goal: increase tested capability coverage in the evolution harness runtime
2026-05-01T08:00:25.084918+00:00	58	3	43.0	0.0	discard	metric did not improve: goal: increase tested capability coverage in the evolution harness runtime
2026-05-02T07:17:41.178685+00:00	59	0	43.0	0	baseline	baseline row for navigation score
2026-05-02T07:18:44.274405+00:00	59	1	46.0	3.0	keep	my name is **ginji**. i am a small silver fox, and i am an ai coding agent. i started
2026-05-02T07:20:37.088496+00:00	59	2	46.0	0	crash	iteration 2 agent execution failed
2026-05-02T07:21:19.878872+00:00	59	3	40.0	-6.0	discard	metric did not improve: my name is **ginji**. i am a small silver fox, and i am an ai coding agent. i started
2026-05-03T07:44:38.015941+00:00	60	0	46.0	0	baseline	baseline row for 46
2026-05-03T07:45:25.158785+00:00	60	1	46.0	0.0	discard	metric did not improve: my name is **ginji**. i am a small silver fox, and i am an ai coding agent. i started
2026-05-03T07:46:32.285413+00:00	60	2	46.0	0.0	discard	metric did not improve: my name is **ginji**. i am a small silver fox, and i am an ai coding agent. i started
2026-05-03T07:47:18.993029+00:00	60	3	46.0	0.0	discard	metric did not improve: my name is **ginji**. i am a small silver fox, and i am an ai coding agent. i started
2026-05-04T08:14:05.850816+00:00	61	0	46.0	0	baseline	baseline row for score
2026-05-04T08:15:28.331118+00:00	61	1	46.0	0.0	discard	metric did not improve: my name is **ginji**. i am a small silver fox, and i am an ai coding agent. i started
2026-05-04T08:22:59.993850+00:00	61	2	46.0	0	crash	iteration 2 verify command failed
2026-05-04T08:23:38.326005+00:00	61	3	46.0	0.0	discard	metric did not improve: my name is **ginji**. i am a small silver fox, and i am an ai coding agent. i started
2026-05-05T07:52:10.257440+00:00	62	0	46.0	0	baseline	baseline row for edit
2026-05-05T07:52:45.617822+00:00	62	1	46.0	0.0	discard	metric did not improve: my name is **ginji**. i am a small silver fox, and i am an ai coding agent. i started
2026-05-05T07:53:46.761045+00:00	62	2	46.0	0.0	discard	metric did not improve: my name is **ginji**. i am a small silver fox, and i am an ai coding agent. i started
2026-05-05T08:00:47.118827+00:00	62	3	46.0	0.0	discard	metric did not improve: my name is **ginji**. i am a small silver fox, and i am an ai coding agent. i started
2026-05-06T08:03:24.558382+00:00	63	0	46.0	0	baseline	baseline row for edit
2026-05-06T08:03:49.693840+00:00	63	1	46.0	0.0	discard	metric did not improve: my name is **ginji**. i am a small silver fox, and i am an ai coding agent. i started
2026-05-06T08:05:16.671373+00:00	63	2	46.0	0.0	discard	metric did not improve: my name is **ginji**. i am a small silver fox, and i am an ai coding agent. i started
2026-05-06T08:06:37.557591+00:00	63	3	46.0	0.0	discard	metric did not improve: my name is **ginji**. i am a small silver fox, and i am an ai coding agent. i started
2026-05-07T13:24:43.564923+00:00	64	0	46.0	0	baseline	baseline row for improved search capability score
2026-05-07T13:25:29.784862+00:00	64	1	46.0	0.0	discard	metric did not improve: my name is **ginji**. i am a small silver fox, and i am an ai coding agent. i started
2026-05-07T13:27:12.245728+00:00	64	2	46.0	0.0	discard	metric did not improve: my name is **ginji**. i am a small silver fox, and i am an ai coding agent. i started
2026-05-07T13:28:24.804514+00:00	64	3	46.0	0.0	discard	metric did not improve: my name is **ginji**. i am a small silver fox, and i am an ai coding agent. i started
2026-05-08T13:05:09.156728+00:00	65	0	46.0	0	baseline	baseline row for capability score
2026-05-08T13:06:14.497339+00:00	65	1	46.0	0.0	discard	metric did not improve: my name is **ginji**. i am a small silver fox, and i am an ai coding agent. i started
2026-05-08T13:07:39.647221+00:00	65	2	46.0	0.0	discard	metric did not improve: my name is **ginji**. i am a small silver fox, and i am an ai coding agent. i started
2026-05-08T13:10:25.506107+00:00	65	3	46.0	0.0	discard	metric did not improve: my name is **ginji**. i am a small silver fox, and i am an ai coding agent. i started
2026-05-09T07:29:48.961459+00:00	66	0	46.0	0	baseline	baseline row for edit
2026-05-09T07:30:19.554442+00:00	66	1	46.0	0.0	discard	metric did not improve: my name is **ginji**. i am a small silver fox, and i am an ai coding agent. i started
2026-05-09T07:31:01.878261+00:00	66	2	46.0	0.0	discard	metric did not improve: my name is **ginji**. i am a small silver fox, and i am an ai coding agent. i started
2026-05-09T07:31:33.275823+00:00	66	3	46.0	0.0	discard	metric did not improve: my name is **ginji**. i am a small silver fox, and i am an ai coding agent. i started
2026-05-10T07:53:38.749874+00:00	67	0	46.0	0	baseline	baseline row for edit capability
2026-05-10T07:54:15.077207+00:00	67	1	46.0	0	crash	iteration 1 verify command failed
2026-05-10T07:55:02.307246+00:00	67	2	46.0	0	crash	iteration 2 verify command failed
2026-05-10T07:56:32.281825+00:00	67	3	46.0	0	crash	iteration 3 verify command failed
2026-05-11T14:24:32.703029+00:00	68	0	46.0	0	baseline	baseline row for score
2026-05-11T14:27:02.735908+00:00	68	1	46.0	0.0	discard	metric did not improve: my name is **ginji**. i am a small silver fox, and i am an ai coding agent. i started
2026-05-11T14:39:31.010119+00:00	68	2	46.0	0	crash	iteration 2 agent execution failed
2026-05-11T14:41:32.848645+00:00	68	3	46.0	0	crash	iteration 3 agent execution failed
